{
  "$schema": "amd-mcp-policy/v1.1",
  "action": "addreferral",
  "domain": "patients",
  "tier": 2,
  "tool_name": "amd_patients_addreferral",
  "redact": {
    "phi_fields": [
      "first_name",
      "firstname",
      "last_name",
      "lastname",
      "middle_name",
      "middlename",
      "dob",
      "date_of_birth",
      "birthdate",
      "ssn",
      "social_security_number",
      "address",
      "address1",
      "address2",
      "city",
      "zip",
      "postal_code",
      "phone_home",
      "phone_cell",
      "phone_work",
      "phone",
      "homephone",
      "officephone",
      "otherphone",
      "email",
      "patient_email",
      "name"
    ],
    "non_phi_keep": [
      "patient_id",
      "patientid",
      "chart_number",
      "chart",
      "carrier_code",
      "carrier_name",
      "carrier_id",
      "carrierid",
      "provider_id",
      "providerid",
      "provider_name",
      "rendering_provider_id",
      "referring_provider_id",
      "appointment_id",
      "appointment_type",
      "plan_type",
      "place_of_service",
      "profile_id",
      "profileid",
      "facility_id",
      "facilityid"
    ],
    "strict_mode_patterns": [
      ".*_name$",
      ".*_dob$"
    ]
  },
  "permission": {
    "audience": [
      "admin"
    ]
  },
  "audit": {
    "always_log": true,
    "log_when_phi_revealed": true
  },
  "write_action": true,
  "permitted_actions": [
    "addreferral"
  ]
}
