{
  "$schema": "amd-mcp-policy/v1.1",
  "action": "addehrhwplans",
  "domain": "ehr",
  "tier": 2,
  "tool_name": "amd_ehr_addehrhwplans",
  "beta": true,
  "redact": {
    "phi_fields": [
      "allergy",
      "reaction",
      "treatment",
      "drugname",
      "medication",
      "medication_name",
      "dose",
      "dosage",
      "frequency",
      "route",
      "immunization",
      "immunization_name",
      "vaccine",
      "resultvalue",
      "result_value",
      "result_name",
      "resultname",
      "note_text",
      "notetext",
      "text",
      "body",
      "problem",
      "problem_text",
      "diagnosis_text",
      "ClinicalDocument",
      "clinical_document",
      "username",
      "userid",
      "user_name",
      "first_name",
      "firstname",
      "last_name",
      "lastname",
      "middle_name",
      "middlename",
      "dob",
      "date_of_birth",
      "birthdate",
      "ssn",
      "social_security_number",
      "address",
      "address1",
      "address2",
      "city",
      "zip",
      "postal_code",
      "phone_home",
      "phone_cell",
      "phone_work",
      "phone",
      "homephone",
      "officephone",
      "otherphone",
      "email",
      "patient_email",
      "name"
    ],
    "non_phi_keep": [
      "patient_id",
      "patientid",
      "chart_number",
      "chart",
      "carrier_code",
      "carrier_name",
      "carrier_id",
      "carrierid",
      "provider_id",
      "providerid",
      "provider_name",
      "rendering_provider_id",
      "referring_provider_id",
      "appointment_id",
      "appointment_type",
      "plan_type",
      "place_of_service",
      "profile_id",
      "profileid",
      "facility_id",
      "facilityid"
    ],
    "strict_mode_patterns": [
      ".*_name$"
    ]
  },
  "permission": {
    "audience": [
      "admin"
    ]
  },
  "audit": {
    "always_log": true,
    "log_when_phi_revealed": true
  },
  "write_action": true,
  "permitted_actions": [
    "addehrhwplans"
  ]
}
