{
  "$schema": "amd-mcp-policy/v1",
  "action": "updvisitwithnewcharges",
  "domain": "billing",
  "tier": 2,
  "tool_name": "amd_billing_upd_visit_with_new_charges",
  "redact": {
    "phi_fields": [],
    "non_phi_keep": [],
    "strict_mode_patterns": []
  },
  "permission": {
    "audience": ["admin"]
  },
  "audit": {
    "always_log": true,
    "log_when_phi_revealed": true
  },
  "write_action": true,
  "permitted_actions": ["updvisitwithnewcharges"]
}
