{
  "$schema": "amd-mcp-policy/v1",
  "action": "addvisit",
  "domain": "visits",
  "tier": 2,
  "tool_name": "amd_visits_add_visit",
  "redact": {
    "phi_fields": [],
    "non_phi_keep": [],
    "strict_mode_patterns": []
  },
  "permission": {
    "audience": ["admin"]
  },
  "audit": {
    "always_log": true,
    "log_when_phi_revealed": true
  },
  "write_action": true,
  "permitted_actions": ["addvisit"]
}
